{
  "job_id": "c0a80100-0000-4000-8000-000000000001",
  "brand_id": "exemplo",
  "content_type": "carousel",
  "slides": 5,
  "channel": "instagram_feed",
  "objective": "collection_launch",
  "visual_direction": ["editorial", "photo_dominant"],
  "asset_constraints": {
    "avoid_subject_position": ["center"]
  },
  "status": "READY_FOR_PLANNING",
  "created_at": "2026-09-17T15:00:00.000Z"
}
